publish_date,id,title,description,keywords,length,views,age_restricted,yt_caption_info,yt_caption_tracks,vid_info
2022-01-01,WvZpwcKGzyU,lat. corona = Zuschauerkreis ; Zuschauer = Annehmen von Programmen ; Hinschauer = Entprogrammierung,"#Matrix #Morpheus #Wissen #RotePille #ThomasVeit #
Es gibt nur einen Menschen auf dieser Welt der dir den Weg zu deinem eigenen Wissen zeigen kann, gehen musst du ihn selbst.. Finde ihn, solange der Zuschauerkreis-virus, der Intelligenz-virus der Maschinen, noch nicht besitzt von dir ergriffen hat

Wer sich informiert kann kein Wissen haben. Ein Wissender Mensch nimmt nie Informationen an, er lässt sie im Raum stehen und verknüpft die einzelnen Informationen zu einem Zusammenhang in dem die Wahrheit sichtbar wird
Wer sich informiert ist ein Zuschauer und wird mit Wörtern, Gedanken, Gefühlen, Sinnen programmiert und gesteuert vom Zentralcomputer (Sonne) aus.
Alles was du glaubst zu Wissen ist kein Wissen sondern Intelligenz, Glaube, Lüge... 
the Matrix has you...

Ein Hinschauer dagegen hat sozusagen Morpheus gefunden bzw. nimmt die rote Pille und hat die Chance wenn er die Impulse erkennt und versteht, sich aus dem Kreis der die Menschen gefangen hält zu verlassen


Ein Kreis ist ein Programm, eine Wiederholung... ein hermetisch abgesperrter Raum der keine Informationen von Außen nach innen lässt und umgekehrt...
das Wissen hat es trotzdem geschafft in die Matrix zu kommen durch Selbsterkenntnis in der Verkörperung von Thomas Veit


Das Wissen auf das jeder Mensch vor der Geburt, dem Vergessen, Zugriff hatte kann durch Thomas Veit (=Zwilling) wieder aktiviert werden..
denn das Wissen hat jeder Mensch noch nur wurde es durch die Programme der Matrix überlagert wie eine Matrjoschka...",[],2648,21,False,"{'a.de': <Caption lang=""German (auto-generated)"" code=""a.de"">}","{'responseContext': {'visitorData': 'CgtmZVl1RF9lNUVXayiLl-GSBg%3D%3D', 'serviceTrackingParams': [{'service': 'GFEEDBACK', 'params': [{'key': 'is_viewed_live', 'value': 'False'}, {'key': 'logged_in', 'value': '0'}, {'key': 'e', 'value': '23946420,24570080,24077241,24163012,24117491,24180128,24196776,24120820,24188847,24034168,23966208,24180089,23885487,24001373,23744176,24198914,24158384,24077266,24074379,1714243,24199774,24063124,24177193,24145515,24186507,24185614,23998056,24036947,24167385,24080738,24135310,23918597,24184785,24175560,24164186,24123943,23882503,24021124,24140247,24196599,24198822,23983296,24138442,24189899,24182212,24176755,24130897,24106839,24004644,24193979,24166248,24007246,24172383,24138064,24161848,24200272,24187043,24184446,24082662,24149832,24186023,24197430,23888717,24175488,24191629,23934970,24189251,24181174,24165080,24185349,24197651,24197047,23827035,24169501,39321475,24085811'}]}, {'service': 'CSI', 'params': [{'key': 'c', 'value': 'ANDROID'}, {'key': 'cver', 'value': '16.20'}, {'key': 'yt_li', 'value': '0'}, {'key': 'GetPlayer_rid', 'value': '0x3c758eb4c98e0ff1'}]}, {'service': 'GUIDED_HELP', 'params': [{'key': 'logged_in', 'value': '0'}]}, {'service': 'ECATCHER', 'params': [{'key': 'client.version', 'value': '16.20'}, {'key': 'client.name', 'value': 'ANDROID'}, {'key': 'client.fexp', 'value': '23946420,24570080,24077241,24163012,24117491,24180128,24196776,24120820,24188847,24034168,23966208,24180089,23885487,24001373,23744176,24198914,24158384,24077266,24074379,1714243,24199774,24063124,24177193,24145515,24186507,24185614,23998056,24036947,24167385,24080738,24135310,23918597,24184785,24175560,24164186,24123943,23882503,24021124,24140247,24196599,24198822,23983296,24138442,24189899,24182212,24176755,24130897,24106839,24004644,24193979,24166248,24007246,24172383,24138064,24161848,24200272,24187043,24184446,24082662,24149832,24186023,24197430,23888717,24175488,24191629,23934970,24189251,24181174,24165080,24185349,24197651,24197047,23827035,24169501,39321475,24085811'}]}, {'service': 'LISTNR', 'params': [{'key': 'e', 'value': '24199774,24030282,24175488,24138064,24033252,24167385,24191629,24176755,24149832,24130897,24570080,24152485,24180089,24140247,24135310,24184785,24106839,24074379,24177193,24193979,24024517,24145515,24186507,24172383,39321475,24164186,24180128,24185614,24198822,24181174,24189899,24036947,24117491'}]}, {'service': 'SUGGEST', 'params': [{'key': 'sugexp', 'value': 'ytv26mc,cfro=1,rankembed.ytb=2'}]}]}, 'playabilityStatus': {'status': 'OK', 'playableInEmbed': True, 'offlineability': {'buttonRenderer': {'serviceEndpoint': {'clickTrackingParams': 'CAIQ6ewBIhMI0u_JtfyT9wIVmtRVCh0c_Q2v', 'ypcGetOfflineUpsellEndpoint': {'params': 'ChPqqN25AQ0KC1d2WnB3Y0tHenlVIgtXdlpwd2NLR3p5VSoVCAkYAVIPCgtXdlpwd2NLR3p5VSAB'}}, 'trackingParams': 'CAIQ6ewBIhMI0u_JtfyT9wIVmtRVCh0c_Q2v'}}, 'miniplayer': {'miniplayerRenderer': {'playbackMode': 'PLAYBACK_MODE_ALLOW'}}, 'contextParams': 'Q0FFU0FnZ0M='}, 'streamingData': {'expiresInSeconds': '21540', 'formats': [{'itag': 17, 'url': 'https://rr4---sn-uxax4vopj5qx-cxgl.googlevideo.com/videoplayback?expire=1649975275&ei=i0tYYpL-Apqp1wKc-rf4Cg&ip=77.11.56.199&id=o-AKFM0si6R_220r8oxsLW-oaGsFRAncoCiwY3vaUuei_Z&itag=17&source=youtube&requiressl=yes&mh=AR&mm=31%2C29&mn=sn-uxax4vopj5qx-cxgl%2Csn-h0jeener&ms=au%2Crdu&mv=m&mvi=4&pl=18&initcwndbps=1036250&vprv=1&mime=video%2F3gpp&gir=yes&clen=14561107&dur=2647.724&lmt=1641077586073741&mt=1649953266&fvip=2&fexp=24001373%2C24007246&c=ANDROID&txp=6211224&sparams=expire%2Cei%2Cip%2Cid%2Citag%2Csource%2Crequiressl%2Cvprv%2Cmime%2Cgir%2Cclen%2Cdur%2Clmt&sig=AOq0QJ8wRQIhALzvjlfGWilmjs22XpjDWiODL6xryt-CYZ3GUlXkF3DQAiANzduXvJveG7WeyfHgYac5LWnuyl9KhH2LVdxc0P_UYQ%3D%3D&lsparams=mh%2Cmm%2Cmn%2Cms%2Cmv%2Cmvi%2Cpl%2Cinitcwndbps&lsig=AG3C_xAwRQIgFRT-QMkLhAaVeJDXMtccmWnEKmsXI-2Ue5hTPwzn3OcCIQDtSfFwrnz3A9BVzwduLhtB1OVd6B-pEDxBoEFZKe2lRw%3D%3D', 'mimeType': 'video/3gpp; codecs=""mp4v.20.3, mp4a.40.2""', 'bitrate': 43999, 'width': 176, 'height': 144, 'lastModified': '1641077586073741', 'contentLength': '14561107', 'quality': 'small', 'fps': 6, 'qualityLabel': '144p', 'projectionType': 'RECTANGULAR', 'averageBitrate': 43995, 'audioQuality': 'AUDIO_QUALITY_LOW', 'approxDurationMs': '2647724', 'audioSampleRate': '22050', 'audioChannels': 1}, {'itag': 18, 'url': 'https://rr4---sn-uxax4vopj5qx-cxgl.googlevideo.com/videoplayback?expire=1649975275&ei=i0tYYpL-Apqp1wKc-rf4Cg&ip=77.11.56.199&id=o-AKFM0si6R_220r8oxsLW-oaGsFRAncoCiwY3vaUuei_Z&itag=18&source=youtube&requiressl=yes&mh=AR&mm=31%2C29&mn=sn-uxax4vopj5qx-cxgl%2Csn-h0jeener&ms=au%2Crdu&mv=m&mvi=4&pl=18&initcwndbps=1036250&vprv=1&mime=video%2Fmp4&cnr=14&ratebypass=yes&dur=2647.678&lmt=1641074040872675&mt=1649953266&fvip=2&fexp=24001373%2C24007246&c=ANDROID&txp=6219224&sparams=expire%2Cei%2Cip%2Cid%2Citag%2Csource%2Crequiressl%2Cvprv%2Cmime%2Ccnr%2Cratebypass%2Cdur%2Clmt&sig=AOq0QJ8wRgIhAIXJfceSWWDPf3l1ASYrUwTxX-Fx6z7Qcx4NmBXmCtpaAiEA2cuy7bUH4JY9PHI6CcKCltUzVVhVdk0cWJrS0pxghfI%3D&lsparams=mh%2Cmm%2Cmn%2Cms%2Cmv%2Cmvi%2Cpl%2Cinitcwndbps&lsig=AG3C_xAwRQIgFRT-QMkLhAaVeJDXMtccmWnEKmsXI-2Ue5hTPwzn3OcCIQDtSfFwrnz3A9BVzwduLhtB1OVd6B-pEDxBoEFZKe2lRw%3D%3D', 'mimeType': 'video/mp4; codecs=""avc1.42001E, mp4a.40.2""', 'bitrate': 164910, 'width': 202, 'height': 360, 'lastModified': '1641074040872675', 'quality': 'small', 'fps': 25, 'qualityLabel': '240p', 'projectionType': 'RECTANGULAR', 'audioQuality': 'AUDIO_QUALITY_LOW', 'approxDurationMs': '2647678', 'audioSampleRate': '44100', 'audioChannels': 2}, {'itag': 22, 'url': 'https://rr4---sn-uxax4vopj5qx-cxgl.googlevideo.com/videoplayback?expire=1649975275&ei=i0tYYpL-Apqp1wKc-rf4Cg&ip=77.11.56.199&id=o-AKFM0si6R_220r8oxsLW-oaGsFRAncoCiwY3vaUuei_Z&itag=22&source=youtube&requiressl=yes&mh=AR&mm=31%2C29&mn=sn-uxax4vopj5qx-cxgl%2Csn-h0jeener&ms=au%2Crdu&mv=m&mvi=4&pl=18&initcwndbps=1036250&vprv=1&mime=video%2Fmp4&cnr=14&ratebypass=yes&dur=2647.678&lmt=1641071641990145&mt=1649953266&fvip=2&fexp=24001373%2C24007246&c=ANDROID&txp=6211224&sparams=expire%2Cei%2Cip%2Cid%2Citag%2Csource%2Crequiressl%2Cvprv%2Cmime%2Ccnr%2Cratebypass%2Cdur%2Clmt&sig=AOq0QJ8wRgIhAMrFCKkMIOMTnQ2qBKMvQXmSmm5BwicoCf0uqQAH7g1xAiEArB178pk7J9AIWJ1TaxRewIfHZ-ldpA8ZiVD7v_XBzH8%3D&lsparams=mh%2Cmm%2Cmn%2Cms%2Cmv%2Cmvi%2Cpl%2Cinitcwndbps&lsig=AG3C_xAwRQIgFRT-QMkLhAaVeJDXMtccmWnEKmsXI-2Ue5hTPwzn3OcCIQDtSfFwrnz3A9BVzwduLhtB1OVd6B-pEDxBoEFZKe2lRw%3D%3D', 'mimeType': 'video/mp4; codecs=""avc1.64001F, mp4a.40.2""', 'bitrate': 231978, 'width': 406, 'height': 720, 'lastModified': '1641071641990145', 'quality': 'medium', 'fps': 25, 'qualityLabel': '360p', 'projectionType': 'RECTANGULAR', 'audioQuality': 'AUDIO_QUALITY_MEDIUM', 'approxDurationMs': '2647678', 'audioSampleRate': '44100', 'audioChannels': 2}], 'adaptiveFormats': [{'itag': 137, 'url': 'https://rr4---sn-uxax4vopj5qx-cxgl.googlevideo.com/videoplayback?expire=1649975275&ei=i0tYYpL-Apqp1wKc-rf4Cg&ip=77.11.56.199&id=o-AKFM0si6R_220r8oxsLW-oaGsFRAncoCiwY3vaUuei_Z&itag=137&source=youtube&requiressl=yes&mh=AR&mm=31%2C29&mn=sn-uxax4vopj5qx-cxgl%2Csn-h0jeener&ms=au%2Crdu&mv=m&mvi=4&pl=18&initcwndbps=1036250&vprv=1&mime=video%2Fmp4&gir=yes&clen=61519350&otfp=1&dur=2647.560&lmt=1641071586913789&mt=1649953266&fvip=2&keepalive=yes&fexp=24001373%2C24007246&c=ANDROID&txp=6216224&sparams=expire%2Cei%2Cip%2Cid%2Citag%2Csource%2Crequiressl%2Cvprv%2Cmime%2Cgir%2Cclen%2Cotfp%2Cdur%2Clmt&sig=AOq0QJ8wRgIhAM7P4rlC4Fg8F2Lx9WD7o-jn3I_hndyxUBO75XZ0Q3SWAiEA2SlUSmwOlIw3CAjAHTvrNl5aFPKmvZAoh4KtwNtwirE%3D&lsparams=mh%2Cmm%2Cmn%2Cms%2Cmv%2Cmvi%2Cpl%2Cinitcwndbps&lsig=AG3C_xAwRQIgFRT-QMkLhAaVeJDXMtccmWnEKmsXI-2Ue5hTPwzn3OcCIQDtSfFwrnz3A9BVzwduLhtB1OVd6B-pEDxBoEFZKe2lRw%3D%3D', 'mimeType': 'video/mp4; codecs=""avc1.64001f""', 'bitrate': 754164, 'width': 608, 'height': 1080, 'initRange': {'start': '0', 'end': '740'}, 'indexRange': {'start': '741', 'end': '6976'}, 'lastModified': '1641071586913789', 'contentLength': '61519350', 'quality': 'large', 'fps': 25, 'qualityLabel': '480p', 'projectionType': 'RECTANGULAR', 'averageBitrate': 185889, 'approxDurationMs': '2647560'}, {'itag': 136, 'url': 'https://rr4---sn-uxax4vopj5qx-cxgl.googlevideo.com/videoplayback?expire=1649975275&ei=i0tYYpL-Apqp1wKc-rf4Cg&ip=77.11.56.199&id=o-AKFM0si6R_220r8oxsLW-oaGsFRAncoCiwY3vaUuei_Z&itag=136&source=youtube&requiressl=yes&mh=AR&mm=31%2C29&mn=sn-uxax4vopj5qx-cxgl%2Csn-h0jeener&ms=au%2Crdu&mv=m&mvi=4&pl=18&initcwndbps=1036250&vprv=1&mime=video%2Fmp4&gir=yes&clen=34209671&otfp=1&dur=2647.560&lmt=1641071582826302&mt=1649953266&fvip=2&keepalive=yes&fexp=24001373%2C24007246&c=ANDROID&txp=6216224&sparams=expire%2Cei%2Cip%2Cid%2Citag%2Csource%2Crequiressl%2Cvprv%2Cmime%2Cgir%2Cclen%2Cotfp%2Cdur%2Clmt&sig=AOq0QJ8wRQIhAK0T9SvXE48HC4WPkdAuRT8w3T8rUqWv2M1QzhDcKHzMAiBPcowNcXodEP_Y7rf6O4_XAOOFGkNAOSBAsSpq6MxoDw%3D%3D&lsparams=mh%2Cmm%2Cmn%2Cms%2Cmv%2Cmvi%2Cpl%2Cinitcwndbps&lsig=AG3C_xAwRQIgFRT-QMkLhAaVeJDXMtccmWnEKmsXI-2Ue5hTPwzn3OcCIQDtSfFwrnz3A9BVzwduLhtB1OVd6B-pEDxBoEFZKe2lRw%3D%3D', 'mimeType': 'video/mp4; codecs=""avc1.64001e""', 'bitrate': 399356, 'width': 406, 'height': 720, 'initRange': {'start': '0', 'end': '741'}, 'indexRange': {'start': '742', 'end': '6977'}, 'lastModified': '1641071582826302', 'contentLength': '34209671', 'quality': 'medium', 'fps': 25, 'qualityLabel': '360p', 'projectionType': 'RECTANGULAR', 'averageBitrate': 103369, 'approxDurationMs': '2647560'}, {'itag': 135, 'url': 'https://rr4---sn-uxax4vopj5qx-cxgl.googlevideo.com/videoplayback?expire=1649975275&ei=i0tYYpL-Apqp1wKc-rf4Cg&ip=77.11.56.199&id=o-AKFM0si6R_220r8oxsLW-oaGsFRAncoCiwY3vaUuei_Z&itag=135&source=yt_otf&requiressl=yes&mh=AR&mm=31%2C29&mn=sn-uxax4vopj5qx-cxgl%2Csn-h0jeener&ms=au%2Crdu&mv=m&mvi=4&pl=18&initcwndbps=1036250&vprv=1&mime=video%2Fmp4&otf=1&otfp=1&dur=0.000&lmt=1641071586913789&mt=1649953266&fvip=2&keepalive=yes&fexp=24001373%2C24007246&c=ANDROID&txp=6210224&sparams=expire%2Cei%2Cip%2Cid%2Citag%2Csource%2Crequiressl%2Cvprv%2Cmime%2Cotf%2Cotfp%2Cdur%2Clmt&sig=AOq0QJ8wRgIhAOyTxzHV6A2gMfNFADk4OAR-jqfHE7iSJJr2PZUc1gZUAiEApujeBm75dZrTHImFd-5dIJAPzsiaIuL0R8ZuAXQwcsk%3D&lsparams=mh%2Cmm%2Cmn%2Cms%2Cmv%2Cmvi%2Cpl%2Cinitcwndbps&lsig=AG3C_xAwRQIgFRT-QMkLhAaVeJDXMtccmWnEKmsXI-2Ue5hTPwzn3OcCIQDtSfFwrnz3A9BVzwduLhtB1OVd6B-pEDxBoEFZKe2lRw%3D%3D', 'mimeType': 'video/mp4; codecs=""avc1.4d400a""', 'bitrate': 1155000, 'width': 270, 'height': 480, 'lastModified': '1641071586913789', 'quality': 'small', 'fps': 25, 'qualityLabel': '240p', 'projectionType': 'RECTANGULAR', 'type': 'FORMAT_STREAM_TYPE_OTF'}, {'itag': 134, 'url': 'https://rr4---sn-uxax4vopj5qx-cxgl.googlevideo.com/videoplayback?expire=1649975275&ei=i0tYYpL-Apqp1wKc-rf4Cg&ip=77.11.56.199&id=o-AKFM0si6R_220r8oxsLW-oaGsFRAncoCiwY3vaUuei_Z&itag=134&source=youtube&requiressl=yes&mh=AR&mm=31%2C29&mn=sn-uxax4vopj5qx-cxgl%2Csn-h0jeener&ms=au%2Crdu&mv=m&mvi=4&pl=18&initcwndbps=1036250&vprv=1&mime=video%2Fmp4&gir=yes&clen=12017283&otfp=1&dur=2647.560&lmt=1641071576008267&mt=1649953266&fvip=2&keepalive=yes&fexp=24001373%2C24007246&c=ANDROID&txp=6216224&sparams=expire%2Cei%2Cip%2Cid%2Citag%2Csource%2Crequiressl%2Cvprv%2Cmime%2Cgir%2Cclen%2Cotfp%2Cdur%2Clmt&sig=AOq0QJ8wRgIhAN_YBQJSLvwzYHWDMk7fY3X5PWKgVckwXEBTqTzuc8IMAiEAiNdd9nuoUFv6LnTR5IxxyfT_g45IGwbKX-WPubNWr8Q%3D&lsparams=mh%2Cmm%2Cmn%2Cms%2Cmv%2Cmvi%2Cpl%2Cinitcwndbps&lsig=AG3C_xAwRQIgFRT-QMkLhAaVeJDXMtccmWnEKmsXI-2Ue5hTPwzn3OcCIQDtSfFwrnz3A9BVzwduLhtB1OVd6B-pEDxBoEFZKe2lRw%3D%3D', 'mimeType': 'video/mp4; codecs=""avc1.4d400d""', 'bitrate': 132623, 'width': 202, 'height': 360, 'initRange': {'start': '0', 'end': '740'}, 'indexRange': {'start': '741', 'end': '6976'}, 'lastModified': '1641071576008267', 'contentLength': '12017283', 'quality': 'small', 'fps': 25, 'qualityLabel': '240p', 'projectionType': 'RECTANGULAR', 'averageBitrate': 36312, 'highReplication': True, 'approxDurationMs': '2647560'}, {'itag': 133, 'url': 'https://rr4---sn-uxax4vopj5qx-cxgl.googlevideo.com/videoplayback?expire=1649975275&ei=i0tYYpL-Apqp1wKc-rf4Cg&ip=77.11.56.199&id=o-AKFM0si6R_220r8oxsLW-oaGsFRAncoCiwY3vaUuei_Z&itag=133&source=yt_otf&requiressl=yes&mh=AR&mm=31%2C29&mn=sn-uxax4vopj5qx-cxgl%2Csn-h0jeener&ms=au%2Crdu&mv=m&mvi=4&pl=18&initcwndbps=1036250&vprv=1&mime=video%2Fmp4&otf=1&otfp=1&dur=0.000&lmt=1641071586913789&mt=1649953266&fvip=2&keepalive=yes&fexp=24001373%2C24007246&c=ANDROID&txp=6210224&sparams=expire%2Cei%2Cip%2Cid%2Citag%2Csource%2Crequiressl%2Cvprv%2Cmime%2Cotf%2Cotfp%2Cdur%2Clmt&sig=AOq0QJ8wRQIgB4Hvyis0oJPuMXLMjEySTZX9r4gaCdrt_aEbdVX2E6MCIQDK2o7yYPxo4XocxGLU5Z95UD_jaVQ8FAw59RkqYnDixw%3D%3D&lsparams=mh%2Cmm%2Cmn%2Cms%2Cmv%2Cmvi%2Cpl%2Cinitcwndbps&lsig=AG3C_xAwRQIgFRT-QMkLhAaVeJDXMtccmWnEKmsXI-2Ue5hTPwzn3OcCIQDtSfFwrnz3A9BVzwduLhtB1OVd6B-pEDxBoEFZKe2lRw%3D%3D', 'mimeType': 'video/mp4; codecs=""avc1.4d400c""', 'bitrate': 242000, 'width': 136, 'height': 240, 'lastModified': '1641071586913789', 'quality': 'tiny', 'fps': 25, 'qualityLabel': '144p', 'projectionType': 'RECTANGULAR', 'type': 'FORMAT_STREAM_TYPE_OTF'}, {'itag': 160, 'url': 'https://rr4---sn-uxax4vopj5qx-cxgl.googlevideo.com/videoplayback?expire=1649975275&ei=i0tYYpL-Apqp1wKc-rf4Cg&ip=77.11.56.199&id=o-AKFM0si6R_220r8oxsLW-oaGsFRAncoCiwY3vaUuei_Z&itag=160&source=yt_otf&requiressl=yes&mh=AR&mm=31%2C29&mn=sn-uxax4vopj5qx-cxgl%2Csn-h0jeener&ms=au%2Crdu&mv=m&mvi=4&pl=18&initcwndbps=1036250&vprv=1&mime=video%2Fmp4&otf=1&otfp=1&dur=0.000&lmt=1641071586913789&mt=1649953266&fvip=2&keepalive=yes&fexp=24001373%2C24007246&c=ANDROID&txp=6210224&sparams=expire%2Cei%2Cip%2Cid%2Citag%2Csource%2Crequiressl%2Cvprv%2Cmime%2Cotf%2Cotfp%2Cdur%2Clmt&sig=AOq0QJ8wRQIgWoorwblc6ExMvkNP6pH8Xu21XNA-XpVa0x4tj6XbdVACIQCgGqY8x_Xq4pKPqmO05P1jgT5ZD-kEJ0DUVxX5oH6Iyg%3D%3D&lsparams=mh%2Cmm%2Cmn%2Cms%2Cmv%2Cmvi%2Cpl%2Cinitcwndbps&lsig=AG3C_xAwRQIgFRT-QMkLhAaVeJDXMtccmWnEKmsXI-2Ue5hTPwzn3OcCIQDtSfFwrnz3A9BVzwduLhtB1OVd6B-pEDxBoEFZKe2lRw%3D%3D', 'mimeType': 'video/mp4; codecs=""avc1.4d400b""', 'bitrate': 108000, 'width': 82, 'height': 144, 'lastModified': '1641071586913789', 'quality': 'tiny', 'fps': 25, 'qualityLabel': '144p', 'projectionType': 'RECTANGULAR', 'type': 'FORMAT_STREAM_TYPE_OTF'}, {'itag': 139, 'url': 'https://rr4---sn-uxax4vopj5qx-cxgl.googlevideo.com/videoplayback?expire=1649975275&ei=i0tYYpL-Apqp1wKc-rf4Cg&ip=77.11.56.199&id=o-AKFM0si6R_220r8oxsLW-oaGsFRAncoCiwY3vaUuei_Z&itag=139&source=youtube&requiressl=yes&mh=AR&mm=31%2C29&mn=sn-uxax4vopj5qx-cxgl%2Csn-h0jeener&ms=au%2Crdu&mv=m&mvi=4&pl=18&initcwndbps=1036250&vprv=1&mime=audio%2Fmp4&gir=yes&clen=16145934&otfp=1&dur=2647.724&lmt=1641071629350992&mt=1649953266&fvip=2&keepalive=yes&fexp=24001373%2C24007246&c=ANDROID&txp=6211224&sparams=expire%2Cei%2Cip%2Cid%2Citag%2Csource%2Crequiressl%2Cvprv%2Cmime%2Cgir%2Cclen%2Cotfp%2Cdur%2Clmt&sig=AOq0QJ8wRAIgZMqxrUW5RONVrJ1q1RKFoQnGRz1jTIWb4FAk9zrTdJUCIFoAc-43UGznQbM2B5r7NgxHrPJOtz8mTVjYy-uLyekj&lsparams=mh%2Cmm%2Cmn%2Cms%2Cmv%2Cmvi%2Cpl%2Cinitcwndbps&lsig=AG3C_xAwRQIgFRT-QMkLhAaVeJDXMtccmWnEKmsXI-2Ue5hTPwzn3OcCIQDtSfFwrnz3A9BVzwduLhtB1OVd6B-pEDxBoEFZKe2lRw%3D%3D', 'mimeType': 'audio/mp4; codecs=""mp4a.40.5""', 'bitrate': 52418, 'initRange': {'start': '0', 'end': '640'}, 'indexRange': {'start': '641', 'end': '3864'}, 'lastModified': '1641071629350992', 'contentLength': '16145934', 'quality': 'tiny', 'projectionType': 'RECTANGULAR', 'averageBitrate': 48784, 'audioQuality': 'AUDIO_QUALITY_LOW', 'approxDurationMs': '2647724', 'audioSampleRate': '22050', 'audioChannels': 2}, {'itag': 140, 'url': 'https://rr4---sn-uxax4vopj5qx-cxgl.googlevideo.com/videoplayback?expire=1649975275&ei=i0tYYpL-Apqp1wKc-rf4Cg&ip=77.11.56.199&id=o-AKFM0si6R_220r8oxsLW-oaGsFRAncoCiwY3vaUuei_Z&itag=140&source=youtube&requiressl=yes&mh=AR&mm=31%2C29&mn=sn-uxax4vopj5qx-cxgl%2Csn-h0jeener&ms=au%2Crdu&mv=m&mvi=4&pl=18&initcwndbps=1036250&vprv=1&mime=audio%2Fmp4&gir=yes&clen=42850480&otfp=1&dur=2647.678&lmt=1641071629362098&mt=1649953266&fvip=2&keepalive=yes&fexp=24001373%2C24007246&c=ANDROID&txp=6211224&sparams=expire%2Cei%2Cip%2Cid%2Citag%2Csource%2Crequiressl%2Cvprv%2Cmime%2Cgir%2Cclen%2Cotfp%2Cdur%2Clmt&sig=AOq0QJ8wRAIgJ38CdIjzp0NIVZh6a1VhjX3fdynxWxrIsOnXZ66WC9UCIFGqLeQQWkHPUoXAzzO1nnPq55UHKNtnCsHRnkMvuCtz&lsparams=mh%2Cmm%2Cmn%2Cms%2Cmv%2Cmvi%2Cpl%2Cinitcwndbps&lsig=AG3C_xAwRQIgFRT-QMkLhAaVeJDXMtccmWnEKmsXI-2Ue5hTPwzn3OcCIQDtSfFwrnz3A9BVzwduLhtB1OVd6B-pEDxBoEFZKe2lRw%3D%3D', 'mimeType': 'audio/mp4; codecs=""mp4a.40.2""', 'bitrate': 132764, 'initRange': {'start': '0', 'end': '631'}, 'indexRange': {'start': '632', 'end': '3855'}, 'lastModified': '1641071629362098', 'contentLength': '42850480', 'quality': 'tiny', 'projectionType': 'RECTANGULAR', 'averageBitrate': 129473, 'highReplication': True, 'audioQuality': 'AUDIO_QUALITY_MEDIUM', 'approxDurationMs': '2647678', 'audioSampleRate': '44100', 'audioChannels': 2}, {'itag': 251, 'url': 'https://rr4---sn-uxax4vopj5qx-cxgl.googlevideo.com/videoplayback?expire=1649975275&ei=i0tYYpL-Apqp1wKc-rf4Cg&ip=77.11.56.199&id=o-AKFM0si6R_220r8oxsLW-oaGsFRAncoCiwY3vaUuei_Z&itag=251&source=youtube&requiressl=yes&mh=AR&mm=31%2C29&mn=sn-uxax4vopj5qx-cxgl%2Csn-h0jeener&ms=au%2Crdu&mv=m&mvi=4&pl=18&initcwndbps=1036250&vprv=1&mime=audio%2Fwebm&gir=yes&clen=38273757&otfp=1&dur=2647.641&lmt=1641071598426415&mt=1649953266&fvip=2&keepalive=yes&fexp=24001373%2C24007246&c=ANDROID&txp=6211224&sparams=expire%2Cei%2Cip%2Cid%2Citag%2Csource%2Crequiressl%2Cvprv%2Cmime%2Cgir%2Cclen%2Cotfp%2Cdur%2Clmt&sig=AOq0QJ8wRAIgB5GddDwYNXeMFXIzND7CUtfvI95r85dsbVvfrrL2yosCIGRNroH5pWpDwakBfmhreTdGYNOEh13_Z4h3ddDZqHWt&lsparams=mh%2Cmm%2Cmn%2Cms%2Cmv%2Cmvi%2Cpl%2Cinitcwndbps&lsig=AG3C_xAwRQIgFRT-QMkLhAaVeJDXMtccmWnEKmsXI-2Ue5hTPwzn3OcCIQDtSfFwrnz3A9BVzwduLhtB1OVd6B-pEDxBoEFZKe2lRw%3D%3D', 'mimeType': 'audio/webm; codecs=""opus""', 'bitrate': 130658, 'initRange': {'start': '0', 'end': '258'}, 'indexRange': {'start': '259', 'end': '4909'}, 'lastModified': '1641071598426415', 'contentLength': '38273757', 'quality': 'tiny', 'projectionType': 'RECTANGULAR', 'averageBitrate': 115646, 'audioQuality': 'AUDIO_QUALITY_MEDIUM', 'approxDurationMs': '2647641', 'audioSampleRate': '48000', 'audioChannels': 2}], 'dashManifestUrl': 'https://manifest.googlevideo.com/api/manifest/dash/expire/1649975275/ei/i0tYYpL-Apqp1wKc-rf4Cg/ip/77.11.56.199/id/5af669c1c286cf25/source/youtube/requiressl/yes/playback_host/rr4---sn-uxax4vopj5qx-cxgl.googlevideo.com/mh/AR/mm/31%2C29/mn/sn-uxax4vopj5qx-cxgl%2Csn-h0jeener/ms/au%2Crdu/mv/m/mvi/4/pl/18/hfr/1/as/fmp4_audio_clear%2Cfmp4_sd_hd_clear/initcwndbps/1036250/vprv/1/mt/1649953266/fvip/2/itag_bl/376%2C377%2C384%2C385%2C612%2C613%2C617%2C619%2C623%2C628%2C655%2C656%2C660%2C662%2C666%2C671/keepalive/yes/fexp/24001373%2C24007246/itag/0/sparams/expire%2Cei%2Cip%2Cid%2Csource%2Crequiressl%2Chfr%2Cas%2Cvprv%2Citag/sig/AOq0QJ8wRAIgDjRsbEFvC_wWBT26Q2sU1vNho4rmvG6Nhb28BcKN2BkCIDeXyz2yI8Svu7P01ZonOm_0edp0ppBBTe5jx5q0H70T/lsparams/playback_host%2Cmh%2Cmm%2Cmn%2Cms%2Cmv%2Cmvi%2Cpl%2Cinitcwndbps/lsig/AG3C_xAwRAIgQhsvslqw-0z4xMIdK32RXzLWgibs8IgI9WcJD0yxm5sCIDpEp7mYumJkvELA1mFI6oglvUji42AlIDA1k_7-oT1A', 'onesieStreamingUrl': 'https://rr4---sn-uxax4vopj5qx-cxgl.googlevideo.com/initplayback?source=youtube&orc=1&oeis=1&c=ANDROID&oss=1&oda=1&oad=7000&ovd=7000&oaad=11000&oavd=11000&ocs=550&oewis=1&ohct=2&oaf1=1&oputc=1&ofpcc=2&osbr=1&osnz=1&id=5af669c1c286cf25&ip=77.11.56.199&initcwndbps=1036250&omo=1&msp=0&mt=1649953266&fvip=2'}, 'playbackTracking': {'videostatsPlaybackUrl': {'baseUrl': 'https://s.youtube.com/api/stats/playback?cl=441313018&docid=WvZpwcKGzyU&ei=i0tYYpL-Apqp1wKc-rf4Cg&fexp=1714243%2C23744176%2C23827035%2C23882503%2C23885487%2C23888717%2C23918597%2C23934970%2C23946420%2C23966208%2C23983296%2C23998056%2C24001373%2C24004644%2C24007246%2C24021124%2C24034168%2C24036947%2C24063124%2C24074379%2C24077241%2C24077266%2C24080738%2C24082662%2C24085811%2C24106839%2C24117491%2C24120820%2C24123943%2C24130897%2C24135310%2C24138064%2C24138442%2C24140247%2C24145515%2C24149832%2C24158384%2C24161848%2C24163012%2C24164186%2C24165080%2C24166248%2C24167385%2C24169501%2C24172383%2C24175488%2C24175560%2C24176755%2C24177193%2C24180089%2C24180128%2C24181174%2C24182212%2C24184446%2C24184785%2C24185349%2C24185614%2C24186023%2C24186507%2C24187043%2C24188847%2C24189251%2C24189899%2C24191629%2C24193979%2C24196599%2C24196776%2C24197047%2C24197430%2C24197651%2C24198822%2C24198914%2C24199774%2C24200272%2C24570080%2C39321475&ns=yt&plid=AAXcn8azV-BS-lap&el=embedded&len=2648&of=-_xhI4eL4MjOL53E0nwGhA&vm=CAEQABgEOjJBS1JhaHdCX3E2UF9WNU52Wmo5U3hTdXBQdHhVUjI3cl85WXpWS2RGYVljVU9kYnZSQWJWQVBta0tESjNUdEhaTnRCM2VoTGl5aTJfTHBZRGc5dElWZzBiNkhHQVBwaWh2bmp4c0FnRF9FbFYzeFh4THVqNUFUWTg0cE1IZTFvbjRPVG85VEZMb1E', 'headers': [{'headerType': 'USER_AUTH'}, {'headerType': 'VISITOR_ID'}, {'headerType': 'PLUS_PAGE_ID'}]}, 'videostatsDelayplayUrl': {'baseUrl': 'https://s.youtube.com/api/stats/delayplay?cl=441313018&docid=WvZpwcKGzyU&ei=i0tYYpL-Apqp1wKc-rf4Cg&fexp=1714243%2C23744176%2C23827035%2C23882503%2C23885487%2C23888717%2C23918597%2C23934970%2C23946420%2C23966208%2C23983296%2C23998056%2C24001373%2C24004644%2C24007246%2C24021124%2C24034168%2C24036947%2C24063124%2C24074379%2C24077241%2C24077266%2C24080738%2C24082662%2C24085811%2C24106839%2C24117491%2C24120820%2C24123943%2C24130897%2C24135310%2C24138064%2C24138442%2C24140247%2C24145515%2C24149832%2C24158384%2C24161848%2C24163012%2C24164186%2C24165080%2C24166248%2C24167385%2C24169501%2C24172383%2C24175488%2C24175560%2C24176755%2C24177193%2C24180089%2C24180128%2C24181174%2C24182212%2C24184446%2C24184785%2C24185349%2C24185614%2C24186023%2C24186507%2C24187043%2C24188847%2C24189251%2C24189899%2C24191629%2C24193979%2C24196599%2C24196776%2C24197047%2C24197430%2C24197651%2C24198822%2C24198914%2C24199774%2C24200272%2C24570080%2C39321475&ns=yt&plid=AAXcn8azV-BS-lap&el=embedded&len=2648&of=-_xhI4eL4MjOL53E0nwGhA&vm=CAEQABgEOjJBS1JhaHdCX3E2UF9WNU52Wmo5U3hTdXBQdHhVUjI3cl85WXpWS2RGYVljVU9kYnZSQWJWQVBta0tESjNUdEhaTnRCM2VoTGl5aTJfTHBZRGc5dElWZzBiNkhHQVBwaWh2bmp4c0FnRF9FbFYzeFh4THVqNUFUWTg0cE1IZTFvbjRPVG85VEZMb1E', 'headers': [{'headerType': 'USER_AUTH'}, {'headerType': 'VISITOR_ID'}, {'headerType': 'PLUS_PAGE_ID'}]}, 'videostatsWatchtimeUrl': {'baseUrl': 'https://s.youtube.com/api/stats/watchtime?cl=441313018&docid=WvZpwcKGzyU&ei=i0tYYpL-Apqp1wKc-rf4Cg&fexp=1714243%2C23744176%2C23827035%2C23882503%2C23885487%2C23888717%2C23918597%2C23934970%2C23946420%2C23966208%2C23983296%2C23998056%2C24001373%2C24004644%2C24007246%2C24021124%2C24034168%2C24036947%2C24063124%2C24074379%2C24077241%2C24077266%2C24080738%2C24082662%2C24085811%2C24106839%2C24117491%2C24120820%2C24123943%2C24130897%2C24135310%2C24138064%2C24138442%2C24140247%2C24145515%2C24149832%2C24158384%2C24161848%2C24163012%2C24164186%2C24165080%2C24166248%2C24167385%2C24169501%2C24172383%2C24175488%2C24175560%2C24176755%2C24177193%2C24180089%2C24180128%2C24181174%2C24182212%2C24184446%2C24184785%2C24185349%2C24185614%2C24186023%2C24186507%2C24187043%2C24188847%2C24189251%2C24189899%2C24191629%2C24193979%2C24196599%2C24196776%2C24197047%2C24197430%2C24197651%2C24198822%2C24198914%2C24199774%2C24200272%2C24570080%2C39321475&ns=yt&plid=AAXcn8azV-BS-lap&el=embedded&len=2648&of=-_xhI4eL4MjOL53E0nwGhA&vm=CAEQABgEOjJBS1JhaHdCX3E2UF9WNU52Wmo5U3hTdXBQdHhVUjI3cl85WXpWS2RGYVljVU9kYnZSQWJWQVBta0tESjNUdEhaTnRCM2VoTGl5aTJfTHBZRGc5dElWZzBiNkhHQVBwaWh2bmp4c0FnRF9FbFYzeFh4THVqNUFUWTg0cE1IZTFvbjRPVG85VEZMb1E', 'headers': [{'headerType': 'USER_AUTH'}, {'headerType': 'VISITOR_ID'}, {'headerType': 'PLUS_PAGE_ID'}]}, 'ptrackingUrl': {'baseUrl': 'https://www.youtube.com/ptracking?ei=i0tYYpL-Apqp1wKc-rf4Cg&plid=AAXcn8azV-BS-lap&pltype=contentugc&ptk=youtube_none&video_id=WvZpwcKGzyU', 'headers': [{'headerType': 'USER_AUTH'}, {'headerType': 'VISITOR_ID'}, {'headerType': 'PLUS_PAGE_ID'}]}, 'qoeUrl': {'baseUrl': 'https://s.youtube.com/api/stats/qoe?cat=otfp&cl=441313018&docid=WvZpwcKGzyU&ei=i0tYYpL-Apqp1wKc-rf4Cg&event=streamingstats&fexp=1714243%2C23744176%2C23827035%2C23882503%2C23885487%2C23888717%2C23918597%2C23934970%2C23946420%2C23966208%2C23983296%2C23998056%2C24001373%2C24004644%2C24007246%2C24021124%2C24034168%2C24036947%2C24063124%2C24074379%2C24077241%2C24077266%2C24080738%2C24082662%2C24085811%2C24106839%2C24117491%2C24120820%2C24123943%2C24130897%2C24135310%2C24138064%2C24138442%2C24140247%2C24145515%2C24149832%2C24158384%2C24161848%2C24163012%2C24164186%2C24165080%2C24166248%2C24167385%2C24169501%2C24172383%2C24175488%2C24175560%2C24176755%2C24177193%2C24180089%2C24180128%2C24181174%2C24182212%2C24184446%2C24184785%2C24185349%2C24185614%2C24186023%2C24186507%2C24187043%2C24188847%2C24189251%2C24189899%2C24191629%2C24193979%2C24196599%2C24196776%2C24197047%2C24197430%2C24197651%2C24198822%2C24198914%2C24199774%2C24200272%2C24570080%2C39321475&ns=yt&plid=AAXcn8azV-BS-lap', 'headers': [{'headerType': 'USER_AUTH'}, {'headerType': 'VISITOR_ID'}, {'headerType': 'PLUS_PAGE_ID'}]}, 'atrUrl': {'baseUrl': 'https://s.youtube.com/api/stats/atr?docid=WvZpwcKGzyU&ei=i0tYYpL-Apqp1wKc-rf4Cg&len=2648&ns=yt&plid=AAXcn8azV-BS-lap&ver=2', 'elapsedMediaTimeSeconds': 3, 'headers': [{'headerType': 'USER_AUTH'}, {'headerType': 'VISITOR_ID'}, {'headerType': 'PLUS_PAGE_ID'}]}, 'engageUrl': {'baseUrl': 'https://s.youtube.com/api/stats/engage?cl=441313018&cmt=%5BVSS_CMT%5D&conn=%5BVSS_CONN%5D&cpn=%5BVSS_CPN%5D&docid=WvZpwcKGzyU&ei=i0tYYpL-Apqp1wKc-rf4Cg&el=embedded&fexp=1714243%2C23744176%2C23827035%2C23882503%2C23885487%2C23888717%2C23918597%2C23934970%2C23946420%2C23966208%2C23983296%2C23998056%2C24001373%2C24004644%2C24007246%2C24021124%2C24034168%2C24036947%2C24063124%2C24074379%2C24077241%2C24077266%2C24080738%2C24082662%2C24085811%2C24106839%2C24117491%2C24120820%2C24123943%2C24130897%2C24135310%2C24138064%2C24138442%2C24140247%2C24145515%2C24149832%2C24158384%2C24161848%2C24163012%2C24164186%2C24165080%2C24166248%2C24167385%2C24169501%2C24172383%2C24175488%2C24175560%2C24176755%2C24177193%2C24180089%2C24180128%2C24181174%2C24182212%2C24184446%2C24184785%2C24185349%2C24185614%2C24186023%2C24186507%2C24187043%2C24188847%2C24189251%2C24189899%2C24191629%2C24193979%2C24196599%2C24196776%2C24197047%2C24197430%2C24197651%2C24198822%2C24198914%2C24199774%2C24200272%2C24570080%2C39321475&lact=%5BVSS_LACT%5D&len=2648&ns=yt&of=-_xhI4eL4MjOL53E0nwGhA&plid=AAXcn8azV-BS-lap&rt=%5BVSS_RT%5D&state=%5BVSS_STATE%5D&vis=%5BVSS_VIS%5D&vm=CAEQABgEOjJBS1JhaHdCX3E2UF9WNU52Wmo5U3hTdXBQdHhVUjI3cl85WXpWS2RGYVljVU9kYnZSQWJWQVBta0tESjNUdEhaTnRCM2VoTGl5aTJfTHBZRGc5dElWZzBiNkhHQVBwaWh2bmp4c0FnRF9FbFYzeFh4THVqNUFUWTg0cE1IZTFvbjRPVG85VEZMb1E', 'headers': [{'headerType': 'USER_AUTH'}, {'headerType': 'VISITOR_ID'}]}, 'videostatsScheduledFlushWalltimeSeconds': [10, 20, 30], 'videostatsDefaultFlushIntervalSeconds': 300}, 'captions': {'playerCaptionsTracklistRenderer': {'captionTracks': [{'baseUrl': 'https://www.youtube.com/api/timedtext?v=WvZpwcKGzyU&caps=asr&xoaf=4&hl=en&ip=0.0.0.0&ipbits=0&expire=1649978875&sparams=ip,ipbits,expire,v,caps,xoaf&signature=895959953CD5F41D93526AE7552D111463DEF93F.2546051E6681A3BD365A44A44F32B1082DCC3919&key=yt8&kind=asr&lang=de&fmt=srv3', 'name': {'runs': [{'text': 'German (auto-generated)'}]}, 'vssId': 'a.de', 'languageCode': 'de', 'kind': 'asr', 'isTranslatable': True}], 'audioTracks': [{'captionTrackIndices': [0]}], 'defaultAudioTrackIndex': 0}}, 'videoDetails': {'videoId': 'WvZpwcKGzyU', 'title': 'lat. corona = Zuschauerkreis ; Zuschauer = Annehmen von Programmen ; Hinschauer = Entprogrammierung', 'lengthSeconds': '2648', 'channelId': 'UCzlH19qwncW1Th9z3tWIeKQ', 'isOwnerViewing': False, 'shortDescription': '#Matrix #Morpheus #Wissen #RotePille #ThomasVeit #\nEs gibt nur einen Menschen auf dieser Welt der dir den Weg zu deinem eigenen Wissen zeigen kann, gehen musst du ihn selbst.. Finde ihn, solange der Zuschauerkreis-virus, der Intelligenz-virus der Maschinen, noch nicht besitzt von dir ergriffen hat\n\nWer sich informiert kann kein Wissen haben. Ein Wissender Mensch nimmt nie Informationen an, er lässt sie im Raum stehen und verknüpft die einzelnen Informationen zu einem Zusammenhang in dem die Wahrheit sichtbar wird\nWer sich informiert ist ein Zuschauer und wird mit Wörtern, Gedanken, Gefühlen, Sinnen programmiert und gesteuert vom Zentralcomputer (Sonne) aus.\nAlles was du glaubst zu Wissen ist kein Wissen sondern Intelligenz, Glaube, Lüge... \nthe Matrix has you...\n\nEin Hinschauer dagegen hat sozusagen Morpheus gefunden bzw. nimmt die rote Pille und hat die Chance wenn er die Impulse erkennt und versteht, sich aus dem Kreis der die Menschen gefangen hält zu verlassen\n\n\nEin Kreis ist ein Programm, eine Wiederholung... ein hermetisch abgesperrter Raum der keine Informationen von Außen nach innen lässt und umgekehrt...\ndas Wissen hat es trotzdem geschafft in die Matrix zu kommen durch Selbsterkenntnis in der Verkörperung von Thomas Veit\n\n\nDas Wissen auf das jeder Mensch vor der Geburt, dem Vergessen, Zugriff hatte kann durch Thomas Veit (=Zwilling) wieder aktiviert werden..\ndenn das Wissen hat jeder Mensch noch nur wurde es durch die Programme der Matrix überlagert wie eine Matrjoschka...', 'isCrawlable': True, 'thumbnail': {'thumbnails': [{'url': 'https://i.ytimg.com/vi/WvZpwcKGzyU/default.jpg', 'width': 120, 'height': 90}, {'url': 'https://i.ytimg.com/vi/WvZpwcKGzyU/mqdefault.jpg', 'width': 320, 'height': 180}, {'url': 'https://i.ytimg.com/vi/WvZpwcKGzyU/hqdefault.jpg', 'width': 480, 'height': 360}]}, 'allowRatings': False, 'viewCount': '21', 'author': 'VEIT CLUB', 'isPrivate': False, 'isUnpluggedCorpus': False, 'isLiveContent': False}, 'playerConfig': {'audioConfig': {'loudnessDb': -8.6, 'perceptualLoudnessDb': -22.6, 'enablePerFormatLoudness': False}, 'exoPlayerConfig': {'useExoPlayer': True, 'useAdaptiveBitrate': True, 'maxInitialByteRate': 91136, 'minDurationForQualityIncreaseMs': 12364, 'maxDurationForQualityDecreaseMs': 3720, 'minDurationToRetainAfterDiscardMs': 21000, 'lowWatermarkMs': 15000, 'highWatermarkMs': 30000, 'lowPoolLoad': 0.8, 'highPoolLoad': 0.8, 'sufficientBandwidthOverhead': 1, 'bufferChunkSizeKb': 50, 'httpConnectTimeoutMs': 16000, 'httpReadTimeoutMs': 8000, 'numAudioSegmentsPerFetch': 1, 'numVideoSegmentsPerFetch': 2, 'minDurationForPlaybackStartMs': 1600, 'enableExoplayerReuse': False, 'useRadioTypeForInitialQualitySelection': True, 'blacklistFormatOnError': False, 'enableBandaidHttpDataSource': True, 'httpLoadTimeoutMs': 18000, 'canPlayHdDrm': True, 'videoBufferSegmentCount': 389, 'audioBufferSegmentCount': 38, 'useAbruptSplicing': False, 'minRetryCount': 10, 'minChunksNeededToPreferOffline': 2, 'secondsToMaxAggressiveness': 0, 'enableSurfaceviewResizeWorkaround': False, 'enableVp9IfThresholdsPass': False, 'matchQualityToViewportOnUnfullscreen': False, 'lowAudioQualityConnTypes': ['MOBILE_CONNECTION_TYPE_CELLULAR_2G', 'MOBILE_CONNECTION_TYPE_CELLULAR_3G'], 'useDashForLiveStreams': True, 'enableLibvpxVideoTrackRenderer': False, 'lowAudioQualityBandwidthThresholdBps': 786432, 'enableVariableSpeedPlayback': False, 'preferOnesieBufferedFormat': True, 'minimumBandwidthSampleBytes': 16384, 'useDashForOtfAndCompletedLiveStreams': True, 'disableCacheAwareVideoFormatEvaluation': False, 'useLiveDvrForDashLiveStreams': True, 'cronetResetTimeoutOnRedirects': True, 'emitVideoDecoderChangeEvents': False, 'onesieVideoBufferLoadTimeoutMs': '0', 'onesieVideoBufferReadTimeoutMs': '0', 'libvpxEnableGl': False, 'enableVp9EncryptedIfThresholdsPass': False, 'enableOpus': False, 'usePredictedBuffer': True, 'maxReadAheadMediaTimeMs': 120000, 'useMediaTimeCappedLoadControl': True, 'allowCacheOverrideToLowerQualitiesWithinRange': 0, 'allowDroppingUndecodedFrames': True, 'minDurationForPlaybackRestartMs': 5000, 'serverProvidedBandwidthHeader': '', 'liveOnlyPegStrategy': 'LIVE_ONLY_PEG_STRATEGY_SEEK_ON_REBUFFER_ESTIMATE_DURATION', 'enableRedirectorHostFallback': True, 'enableHighlyAvailableFormatFallbackOnPcr': False, 'recordTrackRendererTimingEvents': True, 'minErrorsForRedirectorHostFallback': 0, 'nonHardwareMediaCodecNames': ['OMX.ffmpeg.vp9.decoder', 'OMX.google.vp9.decoder', 'c2.android.vp9.decoder', 'OMX.Intel.sw_vd.vp9', 'OMX.MTK.VIDEO.DECODER.SW.VP9', 'c2.android.av1.decoder', 'OMX.sprd.av1.decoder', 'OMX.google.av1.decoder'], 'enableVp9IfInHardware': False, 'enableVp9EncryptedIfInHardware': True, 'useOpusMedAsLowQualityAudio': False, 'minErrorsForPcrFallback': 0, 'useStickyRedirectHttpDataSource': True, 'onlyVideoBandwidth': True, 'useRedirectorOnNetworkChange': False, 'enableMaxReadaheadAbrThreshold': True, 'cacheCheckDirectoryWritabilityOnce': False, 'predictorType': 'PREDICTOR_TYPE_POLYNOMIAL', 'slidingPercentile': 0.5, 'slidingWindowSize': 12, 'maxFrameDropIntervalMs': 100, 'ignoreLoadTimeoutForFallback': False, 'serverBweMultiplier': 1, 'drmMaxKeyfetchDelayMs': 0, 'maxResolutionForWhiteNoise': 0, 'whiteNoiseRenderEffectMode': 'RENDER_EFFECT_MODE_UNKNOWN', 'enableLibvpxHdr': False, 'enableCacheAwareStreamSelection': True, 'useExoCronetDataSource': True, 'whiteNoiseScale': 0, 'whiteNoiseOffset': 0, 'preventVideoFrameLaggingWithLibvpx': False, 'enableMediaCodecHdr': True, 'enableMediaCodecSwHdr': False, 'liveOnlyWindowChunks': 10, 'bearerMinDurationToRetainAfterDiscardMs': [21000, 21000, 21000, 21000, 120000, 120000, 90000, 120000], 'forceWidevineL3': False, 'useAverageBitrate': False, 'useMedialibAudioTrackRendererForLive': True, 'useExoPlayerV2': False, 'logMediaRequestEventsToCsi': True, 'onesieFixNonZeroStartTimeFormatSelection': False, 'liveOnlyReadaheadStepSizeChunks': 1, 'liveOnlyBufferHealthHalfLifeSeconds': 60, 'liveOnlyMinBufferHealthRatio': 0.75, 'liveOnlyMinLatencyToSeekRatio': 3, 'manifestlessPartialChunkStrategy': 'ANDROID_PARTIAL_CHUNK_STRATEGY_RETRY_RANGE_CHECK_LMT', 'ignoreViewportSizeWhenSticky': False, 'enableLibvpxFallback': False, 'disableLibvpxLoopFilter': False, 'enableVpxMediaView': False, 'hdrMinScreenBrightness': 0, 'hdrMaxScreenBrightnessThreshold': 10, 'onesieDataSourceAboveCacheDataSource': True, 'httpNonplayerLoadTimeoutMs': 72000, 'numVideoSegmentsPerFetchStrategy': 'NUM_SEGMENTS_PER_FETCH_STRATEGY_LIMITED_DURATION', 'maxVideoDurationPerFetchMs': 12000, 'maxVideoEstimatedLoadDurationMs': -1, 'estimatedServerClockHalfLife': 5, 'estimatedServerClockStrictOffset': False, 'minReadAheadMediaTimeMs': 0, 'readAheadGrowthRate': 0, 'useDynamicReadAhead': False, 'useYtVodMediaSourceForV2': False, 'enableV2Gapless': False, 'useLiveHeadTimeMillis': True, 'allowTrackSelectionWithUpdatedVideoItagsForExoV2': False, 'maxAllowableTimeBeforeMediaTimeUpdateSec': 15, 'enableDynamicHdr': False, 'v2PerformEarlyStreamSelection': False, 'v2UsePlaybackStreamSelectionResult': False, 'v2MinTimeBetweenAbrReevaluationMs': 2000, 'avoidReusePlaybackAcrossLoadvideos': False, 'enableInfiniteNetworkLoadingRetries': True, 'reportExoPlayerStateOnTransition': False, 'manifestlessSequenceMethod': 'MANIFESTLESS_SEQUENCE_METHOD_LIVE_HEAD', 'useLiveHeadWindow': True, 'enableDynamicHdrInHardware': False, 'ultralowAudioQualityBandwidthThresholdBps': 0, 'retryLiveNetNocontentWithDelay': True, 'ignoreUnneededSeeksToLiveHead': True, 'adaptiveLiveHeadWindow': True, 'drmMetricsQoeLoggingFraction': 0.01, 'liveNetNocontentMaximumErrors': -1, 'waitForDrmLicenseBeforeProcessingAndroidStuckBufferfull': True, 'useTimeSeriesBufferPrediction': False}, 'playbackStartConfig': {'startTimeToleranceBeforeMs': '20000'}, 'adRequestConfig': {'filterTimeEventsOnDelta': 10000, 'useCriticalExecOnAdsPrep': True, 'userCriticalExecOnAdsProcessing': True, 'enableCountdownNextToThumbnailAndroid': True, 'preskipScalingFactorAndroid': 0.712, 'preskipPaddingAndroid': 6}, 'networkProtocolConfig': {'useQuic': True}, 'androidNetworkStackConfig': {'networkStack': 'CRONET', 'androidCronetResponsePriority': {'priorityValue': 'BACKGROUND_10_THREAD_PRIORITY'}, 'androidMetadataNetworkConfig': {'coalesceRequests': True}}, 'lidarSdkConfig': {'enableActiveViewReporter': True, 'useMediaTime': True, 'sendTosMetrics': True, 'usePlayerState': False, 'enableIosAppStateCheck': True, 'enableImprovedSizeReportingAndroid': True, 'enableIsAndroidVideoAlwaysMeasurable': True}, 'androidMedialibConfig': {'isItag18MainProfile': True, 'dashManifestVersion': 5, 'initialBandwidthEstimates': [{'detailedNetworkType': 'DETAILED_NETWORK_TYPE_WIFI', 'bandwidthBps': '921853'}, {'detailedNetworkType': 'DETAILED_NETWORK_TYPE_LTE', 'bandwidthBps': '631467'}], 'viewportSizeFraction': 0.85, 'selectLowQualityStreamsWithHighBitrates': True, 'enablePrerollPrebuffer': True, 'prebufferOptimizeForViewportSize': True, 'hpqViewportSizeFraction': 0.58}, 'playerControlsConfig': {'showCachedInTimebar': True}, 'variableSpeedConfig': {'showVariableSpeedDisabledDialog': True}, 'decodeQualityConfig': {'maximumVideoDecodeVerticalResolution': 2160}, 'vrConfig': {'allowVr': True, 'allowSubtitles': True, 'showHqButton': True, 'sphericalDirectionLoggingEnabled': True, 'enableAndroidVr180MagicWindow': True, 'enableAndroidMagicWindowEduOverlay': True, 'magicWindowEduOverlayText': 'Move device to explore video', 'magicWindowEduOverlayAnimationUrl': 'https://youtube.com/img/vr/magic_window_edu_overlay_animation_v2.webp'}, 'qoeStatsClientConfig': {'batchedEntriesPeriodMs': '30000'}, 'androidPlayerStatsConfig': {'usePblForAttestationReporting': False, 'usePblForHeartbeatReporting': False, 'usePblForPlaybacktrackingReporting': False, 'usePblForQoeReporting': True, 'changeCpnOnFatalPlaybackError': True}, 'stickyQualitySelectionConfig': {'stickySelectionType': 'DISABLE_STICKY', 'expirationTimeSinceLastManualVideoQualitySelectionMs': '259200000', 'expirationTimeSinceLastPlaybackStartMs': '18000000', 'stickyCeilingOverridesSimpleBitrateCap': True}, 'adSurveyRequestConfig': {'useGetRequests': True}, 'retryConfig': {'retryEligibleErrors': ['fmt.decode', 'android.exo.fatal', 'scripted_player.js.fatal', 'android.stuck.bufferfull', 'player.timeout'], 'retryUnderSameConditionAttempts': 1, 'retryWithNewSurfaceAttempts': 1, 'progressiveFallbackOnNonNetworkErrors': True, 'l3FallbackOnDrmErrors': True, 'retryAfterCacheRemoval': True, 'widevineL3EnforcedFallbackOnDrmErrors': True, 'exoProxyableFormatFallback': True, 'maxPlayerRetriesWhenNetworkUnavailable': 2, 'retryWithLibvpx': True, 'suppressFatalErrorAfterStop': False, 'fallbackFromHfrToSfrOnFormatDecodeError': True}, 'cmsPathProbeConfig': {'cmsPathProbeDelayMs': 7000}, 'mediaCommonConfig': {'dynamicReadaheadConfig': {'maxReadAheadMediaTimeMs': 160000, 'minReadAheadMediaTimeMs': 15000, 'readAheadGrowthRateMs': 300, 'readAheadWatermarkMarginRatio': 0, 'minReadAheadWatermarkMarginMs': 0, 'maxReadAheadWatermarkMarginMs': 0, 'shouldIncorporateNetworkActiveState': False}, 'mediaUstreamerRequestConfig': {'enableVideoPlaybackRequest': True, 'videoPlaybackUstreamerConfig': 'CpMCCAAlMZkqPi0AAIA_NT0Klz9YAXjoAoABAaABAbUB9ijcP-ABAegBA_ABAfkBAAAAAAAA0D-BAgAAAAAAABhAmALwAaAC6ALaAkQQsOoBGKhGIKCcASjYNjCYdUgBUAFYAWgBcIgngAH0A9ABAeABAfABAYACAZgCDKgCAbACAbgCAcACAcgCAegCAvgCAfoCKQgMEBgYMiAyLQAAcEI1AACMQkABSAFlAACAQGjAcHABiAEBzQEAAIA_ggMAiAMBkAMA4AOQTrAEAbgEAcoEQwoTCIDiCRCYdRisAiUAAAAAKAAwABCAqNa5BxjQDyohCgp0Yl9jb3N0XzUwIAgpAAAAAAAAAABdmpmZPmUAAAA_MAEYASABMgwIiQEQ_dv0h7yR9QIyDAiIARC-nvuFvJH1AjIMCIcBEP3b9Ie8kfUCMgwIhgEQy4zbgryR9QIyDAiFARD92_SHvJH1AjIMCKABEP3b9Ie8kfUCMgwIiwEQ0PCSnLyR9QIyDAiMARCyx5OcvJH1AjIMCPsBEK-ys428kfUCOgA=', 'videoPlaybackPostEmptyBody': False, 'isVideoPlaybackRequestIdempotent': True}, 'predictedReadaheadConfig': {'minReadaheadMs': 5000, 'maxReadaheadMs': 157000}, 'mediaFetchRetryConfig': {'initialDelayMs': 1000, 'backoffFactor': 1.3, 'maximumDelayMs': 20000, 'jitterFactor': 0.1}, 'mediaFetchMaximumServerErrors': 10, 'mediaFetchMaximumNetworkErrors': -1, 'mediaFetchMaximumErrors': 10, 'serverReadaheadConfig': {'enable': True, 'nextRequestPolicy': {'targetAudioReadaheadMs': 120000, 'targetVideoReadaheadMs': 120000}}}, 'playerGestureConfig': {'downAndOutLandscapeAllowed': True, 'downAndOutPortraitAllowed': True}}, 'storyboards': {'playerStoryboardSpecRenderer': {'spec': 'https://i.ytimg.com/sb/WvZpwcKGzyU/storyboard3_L$L/$N.jpg?sqp=-oaymwGbA0g48quKqQOSA4gBAZUBAAAEQpgBMqABPKgBBLABELABDbABDLABELABFbABH7ABJrABLbABDrABDrABD7ABErABF7ABK7ABLLABKbABD7ABDrABELABFbABH7ABKrABMrABKbABD7ABEbABFLABGLABJrABPbABOLABLbABEbABFLABHrABKrABMbABS7ABR7ABNrABFbABHLABKbABLrABObABR7ABTbABP7ABJbABLrABN7ABPbABR7ABUrABUbABRbABM7ABQLABQrABQ7ABTLABRLABRrABQ7gBEbgBEbgBFbgBI7gBRLgBQ7gBQ7gBQ7gBEbgBE7gBFrgBL7gBQ7gBQ7gBQ7gBQ7gBFbgBFrgBKbgBQ7gBQ7gBQ7gBQ7gBQ7gBI7gBL7gBQ7gBQ7gBQ7gBQ7gBQ7gBQ7gBRLgBQ7gBQ7gBQ7gBQ7gBQ7gBQrgBQrgBQ7gBQ7gBQ7gBQ7gBQ7gBQrgBQrgBQrgBQ7gBQ7gBQ7gBQ7gBQrgBQrgBQrgBQrgBQ7gBQ7gBQ7gBQrgBQrgBQrgBQrgBQqLzl_8DBgjmhcOOBg==|48#27#100#10#10#0#default#rs$AOn4CLAAX8GPvL7yaz2DxJ2hbKrdQjde4A|25#45#266#10#10#10000#M$M#rs$AOn4CLCn87pxG7OvP1DLtxPkaZbM7uz_UA|50#90#266#5#5#10000#M$M#rs$AOn4CLC-nKhdgffS-hzVUgpDTC1Ev0sO9g', 'recommendedLevel': 2}}, 'trackingParams': 'CAAQu2kiEwjS78m1_JP3AhWa1FUKHRz9Da8=', 'attestation': {'playerAttestationRenderer': {'challenge': 'a=5&a2=1&b=CB5-A6iEBbIvDZ3PsBa1GG2_pMI&c=1649953675&d=3&e=WvZpwcKGzyU&c5a=1&c5b=yt_player_ias&hh=MtSb9hPIP6IRVlCEJuMCJU-Ao6H0B7Kv9-p5zisgXUE'}}, 'adBreakParams': '', 'playerSettingsMenuData': {'loggingDirectives': {'trackingParams': 'CAEQtc4GIhMI0u_JtfyT9wIVmtRVCh0c_Q2v', 'visibility': {'types': '12'}}}}",0
